28107,taobao.xhotel.order.future.facescan.put,未来酒店扫脸信息上传,未来酒店扫脸信息上传服务，用于悉尔等厂商的扫脸设备对接
28110,taobao.tbk.item.coupon.get,单品加券检索api,检索有优惠券的单品
28111,taobao.tbk.itemid.coupon.get,根据nid批量查询优惠券,根据nid批量查询优惠券
28131,taobao.promotion.util.querytaobaoidbymobile,根据手机号码查询淘宝id,根据手机号码查询淘宝id
28132,alitrip.daytours.product.upload,境外一日游/多日游 产品维护接口,境外一日游/多日游 产品维护接口。
接口同时支持新商品发布 和 现有商品编辑：
1）只上传out_product_id的情况：如果out_product_id已经关联过某个商品id，则认为是编辑现有商品，否则认为是新发布一个商品。
2）同时上传out_product_id和item_id，则认为是将out_product_id与item_id进行关联，同时对该商品进行编辑。
28138,taobao.entopen.terminal.info.get,数据平台终端信息获取,数据平台终端信息获取
28139,taobao.inventory.occupy.rollback,库存占用释放,非交易占用库存回补接口
28140,alibaba.ai.ar.service.detect,ailab AR图像检索,ailab AR图像检索
28142,yunos.tv.tao.point.querypointdetaillist,查询指定用户积分收入和支出明细,查询指定用户积分收入和支出明细
28143,yunos.tv.tao.point.addpointdetailrecord,指定用户发送积分接口,指定用户发送积分
28144,yunos.tv.tao.point.querycurrenttotal,获取用户当前积分信息,获取用户在电视淘宝上的积分信息（当前可用积分，即将过期积分，是否获得过积分标识）
28145,yunos.tv.tao.point.exchangeforgift,积分兑换红包接口,给指定的用户，通过积分兑换来红包, 优先消费即将过期积分
28151,taobao.nextone.logistics.sign.update,AG物流签收状态写接口,商家上传退货的签收状态给AG
28152,taobao.entopen.terminal.logininfo.get,数据平台终端登入登出信息获取,数据平台终端登入登出信息获取
28154,tmall.miaoshop.member.get,获取单个会员信息API,获取单个会员信息API
28156,taobao.tbk.item.click.extract,链接解析api,从长链接或短链接中解析出open_iid
28157,taobao.eticket.merchant.tbma.get,码商查询淘宝码接口,码商查询淘宝码接口
28158,alibaba.nlife.b2c.trade.create,零售+平台创建订单,零售+平台创建订单接口
28159,alibaba.nlife.b2c.trade.cancel,零售+平台取消订单,零售+平台取消订单接口
28160,alibaba.nlife.b2c.trade.refund,零售+请求退款,零售+平台请求退款接口，在零售+平台不会有资金流变动，只是订单状态的更新
28161,alibaba.nlife.b2c.trade.pay,零售+平台支付订单,零售+平台支付接口，外部商户调用此接口告知零售+支付结果，保持订单状态同步
28162,alibaba.nlife.b2c.trade.get,零售+平台查询订单,查询零售+平台创建出来的订单详情
28163,alibaba.nlife.item.price.get,查询商品价格,ISV查询零售+平台商品价格
28164,alibaba.nlife.b2c.trade.download,b2c下载订单,下载零售商在零售+平台创建的订单
28171,alibaba.security.turing.platform.access.add.platform.user,图灵服务平台用户接入,提供平台用户的图灵服务接入
28173,alibaba.security.turing.platform.access.pic.fetch,图灵服务平台用户生成图片,提供平台用户的生成图片服务
28175,alitrip.travel.trade.close,卖家关单（快速退款接口）,卖家关单（快速退款接口），不支持二次确认，二次预约商品的订单
28176,alitrip.travel.trade.deliver,无需物流普通商品发货接口,航旅度假无需物流普通商品发货接口（不支持二次预约商品），只支持子订单级别发货
28180,alibaba.einvoice.diskoffline.get,下架工单查询接口,查询下架工单详细信息
28181,alibaba.einvoice.diskoffline.update,下架单状态回传接口,开票服务商回传税盘下架单状态
28184,yunos.ospush.open.app.push.pubtag,指定标签发送透传消息接口,该接口使用OS公共标签圈定人群，然后向该人群发送透传消息。
28185,taobao.streetest.session.get,根据获取压测用户的sessionKey,根据正常用户sessionKey获取对应压测用户的sessionKey，该sessionKey只能用户服务商全链路压测
28186,taobao.wangwang.eservice.icbu.abs.word.get,聊天记录关键字列表获取接口,获取关键词列表
28187,alibaba.aliqin.secret.axb.updatecallrestrict,呼叫方向权限控制,呼叫方向权限控制
28188,yunos.ospush.open.push.task.result,发送结果实时查询接口,发送结果实时查询接口
28189,yunos.ospush.open.app.push.device,用户设备透传接口,该接口发送透传消息给指定的设备。
28191,taobao.wangwang.eservice.icbu.abs.chatlog.get,聊天记录查询接口（ICBU）,查询授权商家的聊天记录
28192,alibaba.wt.verify.fetchdata,阿里通信实人认证数据拉取接口,买家实人认证通过后，商家通过这个接口来拉取买家的数据
28193,taobao.wangwang.eservice.icbu.abs.word.del,关键字删除接口（ICBU）,删除关键词接口
28194,taobao.wangwang.eservice.icbu.abs.word.add,关键字添加接口（ICBU）,为聊天记录查询接口添加关键词。
28195,taobao.wangwang.eservice.icbu.chatrelation.get,聊天关系获取接口（ICBU）,获取指定时间区间内的聊天关系（查询账号，和谁，在哪天说过话）。如：
A 和 B 在2016-09-01 和 2016-09-02 都说过话。以A为查询账号，则该接口将返回：
2016-09-01， B
2016-09-02， B
28205,yunos.tv.tao.syncdatapush,电视淘宝数据推送接口,接受央广购物视频打点的接口
28206,taobao.nextone.logistics.warehouse.update,AG退货入仓状态写接口,商家上传退货入仓状态给ag
28207,alibaba.base.order.supplier.notify,阿里通信运营商信息回传,接收阿里通信流量运营商信息回传
28208,tmall.miaoshop.ad.image.list,获取门店POS机屏幕广告位轮播图片数据,获取门店POS机屏幕广告位轮播图片数据
28215,taobao.taotv.tvtrade.ticket.status,全球播票据状态变更接口,全球播票据状态变更接口
28216,tmall.servicecenter.task.queryrefund,查询任务类工单是否退款,查询任务类工单是否退款
28218,taobao.ju.temai.mlh.long.sale.item.synchronize,魅力惠长销商品同步,同步长销商品标签，同步长销商品价格，长销商品上架
28219,tmall.mlh.po.confirm,采购收货确认,魅力惠scm与wms通信，wms通过该API将采购单收货入库的确认信息回传。这里的数据是从外部的WMS写入到内部的scm中，返回值只有是否成功的true/false，无需数据披露
28220,tmall.mlh.orderstatus.callback,销售订单状态回传,魅力惠对接scm2.0，魅力惠scm开放接口给wms，wms通过该接口将订单的发货物流信息同步给scm，数据写入，无数据披露
28221,tmall.mlh.returnin.confirm,销退入库确认,魅力惠对接scm2.0，魅力惠所使用的wms通过该接口将销退入库的信息同步给到魅力惠scm系统，无数据披露
28222,tmall.mlh.ro.confirm,退仓单出库确认,魅力惠对接scm2.0，魅力惠wms通过该接口将退仓单出库确认信息同步给魅力惠scm，只写进来数据，无数据披露
28223,tmall.mlh.transfer.callback,库存转移同步,魅力惠对接scm2.0，魅力惠wms通过该接口将库存转移的信息同步给魅力惠scm，只有数据写入，无数据披露
28224,tmall.mlh.inventory.callback,杂项出入库同步,魅力惠对接scm2.0，魅力惠wms通过该接口将杂项出入库的信息同步给魅力惠scm，只有数据写入，无数据披露
28225,cainiao.smartdelivery.strategy.i.query,查询智能发货引擎发货策略设置,查询智能发货引擎发货策略设置
28226,cainiao.smartdelivery.priceoffer.i.update,设置或更新智能发货引擎价格信息模板,智能发货引擎更新价格信息模板
28227,cainiao.smartdelivery.cocps.i.query,获取电子面单订购关系中智能发货引擎支持的合作物流公司,获取电子面单订购关系中智能发货引擎支持的合作物流公司
28228,alibaba.scm.gateway.order.paid.done,支付完成接口,支付完成接口
28229,taobao.promotioncenter.coupon.exchangecode.get,卡券兑换码获取接口,获取优惠券的兑换码
28230,cainiao.smartdelivery.strategy.i.update,设置或更新智能发货引擎发货策略,更新智能发货引擎发货策略设置
28231,cainiao.smartdelivery.priceoffer.i.query,查询智能发货引擎商家价格信息,查询智能发货引擎商家价格信息
28232,yunos.id.sk.encode,id2加密接口,对id2对指定字符串进行加密
28235,alibaba.lottery.bingo.cancel,取消游戏交易,外部游戏交易取消
28239,taobao.place.store.businesstime,门店营业时间批量修改,提供工具或接口，支持优衣库进行批量的门店营业时间设置操作；
28242,taobao.entopen.program.audientrank.get,获取节目热榜top20收视情况,获取节目热榜top20收视情况
28243,taobao.entopen.terminal.monthboot.get,按月度统计终端开机数据,按月度统计终端开机数据
28244,taobao.entopen.terminal.areaboot.get,终端开机统计-按区域,终端开机统计-按区域
28245,taobao.entopen.terminal.timeboot.get,终端开机统计-按时段,终端开机统计-按时段
28246,taobao.entopen.terminal.dayboot.get,终端开机统计-按天,终端开机统计-按天
28247,cainiao.endpoint.locker.top.gui.setstatus,设置柜子状态,修改柜子状态
28248,cainiao.endpoint.locker.top.gui.addorupdate,自提柜新增或修改接口,新增或者修改自提柜相关信息
28250,cainiao.endpoint.locker.top.order.tracking,事件回传接口,事件回传接口，自提柜公司回传所有的柜子动作信息，例如小件员投件，用户取件等
28251,alibaba.nlife.b2b.trade.accept,B2B交易-供货商接受采购申请,B2B交易-供货商接受采购申请
28252,alibaba.nlife.b2b.trade.refuse,B2B交易-供货商拒绝采购申请,B2B交易接口 - 供货商拒绝采购申请
28253,alibaba.nlife.b2b.trade.consign,B2B交易-供货商发货,B2B交易-供货商发货
28257,alibaba.lottery.bingo.conch,游戏告警,提交游戏错误告警
28260,alibaba.music.recommend.dailysongs.get,获取今日推荐歌单接口,获取今日推荐歌单接口
28261,alibaba.nlife.b2b.trade.get,B2B交易 - 获取采购单详情,供货商系统在收到采购单状态变化通知消息后，经此接口获取采购单详细信息，用以下一步的处理；
28267,taobao.weex.project.upload,weex小程序上传,weex小程序上传
28269,tmall.miaoshop.item.list,获取门店商品数据,获取天猫门店系统接入企业门店商品
28270,tmall.miaoshop.category.list,获取商品类目树,获取门店商品类目树
28271,tmall.miaoshop.member.list,批量获取会员信息API,批量获取会员信息API
28272,tmall.miaoshop.offline.order.put,线下订单数据回流API,线下订单数据回流API
28273,tmall.miaoshop.item.price.list,获取商品会员价API,获取门店商品会员价格，包括会员价、活动会员价
28286,taobao.edu.live.getisvpushflowstatus,获取isv推流状态,获取isv推流状态
28287,taobao.edu.live.getactivitylog,获取活动日志,课堂日志
28288,alibaba.apolloplatform.litigation.schedule.get,获取用户诉讼进度信息,用户将诉讼材料通过平台提交以后，需要从律师平台获取该案件的处理进度
28289,alibaba.apolloplatform.litigation.material.submit,法律工具用户诉讼材料递交,使用法律工具的用户，收到广告法相关诉讼时，将诉讼材料提交平台
28290,alibaba.einvoice.merchant.createreq,商家自研ERP开票请求接口,商家自研ERP发起开票请求，无需授权，API只能使用商家入驻的税号进行开票
28291,alibaba.einvoice.merchant.result.get,商家自研ERP开票结果获取,商家自研ERP开票结果获取
28292,alibaba.einvoice.merchant.results.increment.get,商家自研ERP增量开票结果获取,商家自研增量开票结果获取
28293,taobao.film.data.scv.phone.get,Scv模型手机号查询,根据指定条件查询符合条件的粤科会员的手机号
28294,taobao.film.data.scv.facet.get,scv查询接口,查询使用电影相关订单数据以及集团内部的用户数据构建的SCV模型的聚合信息。
28297,cainiao.yima.dispatch.getitem,获取单个派件列表详情,根据mailno获取单个派件列表详情
28298,cainiao.smartdelivery.cp.i.modify,智能发货引擎修改cp信息接口,商家修改智能发货引擎推荐的cp
28302,cainiao.smartdelivery.i.get,智能发货引擎获取接口（获取智选cp和电子面单信息）,获取智选cp和电子面单信息
28304,cainiao.yima.order.feedbackgottimeoutbycourier,小件员反馈揽件超时原因,小件员反馈揽件超时原因
28305,cainiao.yima.order.queryfeedbackreasons,查询超时关闭反馈原因列表,查询超时关闭反馈原因列表
28306,taobao.qiannniu.dispatch.service.account.solution.set,服务助手关联问题设置,更新服务助手关联问题
28308,alibaba.security.turing.platform.access.user.delete,删除用户接口,提供图灵平台用户删除某一个用户
28309,cainiao.guoguo.delivery.functionswitch,获取功能开关配置信息,获取功能开放与否的配置信息
28310,cainiao.guoguo.task.readtask,订单已读传输接口,批量传输已读订单信息
28311,alibaba.security.turing.platform.access.js.fetch,图灵服务平台用户获取JS代码,平台用户获取js代码及afskey
28313,alibaba.alink.device.bind,绑定设备,阿里智能解绑设备
28317,cainiao.guoguo.graborder.querycompletedorders,小件员查询完成的任务列表,小件员查询完成的任务列表
28318,cainiao.guoguo.graborder.queryuncompletedorders,小件员查询待完成订单列表,小件员查询待完成订单列表
28320,yunos.osupdate.fotabuildrecommendinfo.query,获取FOTA包打包推荐信息,根据给定的设备型号和系统版本号获取FOTA包制作推荐信息。目前推荐信息包括两部分：1）推荐信息摘要；2）每个系统版本的设备占比的相关信息。
28321,alipay.ins.alitrip.query,航旅订单维度的保险查询,以订单号为维度，进行保险订单的查询
28322,taobao.xhotel.order.account.statement,查询订单对账信息,阿里根据此接口定义输出订单对账信息，供各合作商家使用
28323,alipay.ins.alitrip.surrender,退保TOP接口,通过保单号，对航旅保单进行退保
28324,yunos.ospush.open.notify.push.pubtag,指定标签发送通知消息接口,该接口使用OS公共标签圈定人群，然后向该人群发送通知消息。
28325,alibaba.lassen.abroad.sign.apply,申请通知签章,通知网上法庭签章文件
28326,alibaba.lassen.abroad.sign.download,签章文件下载,通过uploadfileid获取签章后的文件
28327,alibaba.alink.device.detail.get,获取设备详情,阿里智能获取设备详情
28329,alibaba.alink.message.history.action,操作历史消息,阿里智能操作历史消息
28330,alibaba.alink.message.config.set,消息提醒开关,阿里智能消息开关
28331,alibaba.alink.message.config.list,查询消息开关配置列表,阿里智能获取消息开关配置列表
28332,alibaba.alink.message.history.count,查询消息总数,查询消息总数
28333,alibaba.alink.message.history.list,查询消息列表,查询消息列表
28334,alibaba.alink.device.info.update,更新设备昵称等信息,更新设备昵称等信息
28335,alibaba.alink.device.unbind,解绑设备,阿里智能解绑设备
28339,alibaba.lassen.abroad.legalcase.send,法庭案件主要信息推送,法庭案件主要信息推送 主要是legalcase表记录
28343,yunos.ospush.open.notify.push.device,用户设备通知接口,该接口发送通知消息给指定的设备
28345,yunos.ospush.open.tagvalue.get,标签tagValues查询接口,标签tagValues查询接口
28346,yunos.ospush.open.tagcode.get,标签tagCode查询接口,标签tagCode查询接口
28347,taobao.tbk.data.report,日志上行api,日志上行api
28352,alibaba.mj.xlife.goods.intimeservice,银泰商品同步,同步银泰商品
28353,taobao.pinxiao.quananbao.effect.ad.get,品销宝宝洁定制广告效果数据接口,品销宝宝洁定制效果数据接口
28354,taobao.pinxiao.quananbao.report.ad.get,品销宝宝洁定制广告数据接口,品销宝宝洁定制数据接口
28355,yunos.tv.advert.site.ykott.get,获取优酷OTT广告位,youku OTT广告SDK调用，从youku广告库获取广告
28356,cainiao.endpoint.locker.top.order.query.user,查询订单用户信息,订单用户的标签属性，业务属性等信息查询
28357,cainiao.endpoint.locker.top.order.query.package,查询订单的包裹信息,查询柜子订单的包裹相关信息，包括收件人电话，包裹所属快递公司等
28363,cainiao.endpoint.locker.spi.order.query_1.0,自提柜订单查询,自提柜服务查询柜子订单
28364,alibaba.happytrip.taxi.order.confirm,费用确认,1.司机点结束计费,欢行会收到正常支付待评论 回调,确认费用无误欢行可以通过此接口确认并支付。
2.如果欢行一直不调用此接口,订单会在48小时后自动支付。
28365,alibaba.happytrip.taxi.order.get,订单详情,获取订单状态及详情
28366,alibaba.happytrip.taxi.order.create,用户叫车,用户根据需要发起叫车请求，在发起请求之前必须事先获得order id.
28367,alibaba.happytrip.taxi.price.get,获取价格预估信息,打车价格预估
28368,alibaba.happytrip.taxi.id.get,获取请求id,预生成订单id。当欢行创建供应商订单时可能因为网络或其他原因返回失败，但实际上该订单在供应商端已经创建成功。欢行有失败自动重试的机制，当重试前会先用上次预生成的失败订单id向供应商查询或主动取消一次以确保该订单在供应商端也是失败的。
28369,alibaba.happytrip.taxi.order.complain,用户投诉,一个订单只能投诉一次，不可重复投诉
28370,alibaba.happytrip.taxi.order.cancel,取消叫车,取消叫车订单,行程中的订单不能取消
28371,alibaba.happytrip.taxi.citystatus.get,获取城市服务开通状态,（该API已经在废弃中，请使用alibaba.happytrip.taxi.servicestatus.get ）获取快车供应商的服务在每个城市开通的状态
28372,alibaba.happytrip.provider.healthcheck,健康检查,欢行服务端会每隔5秒钟访问一次服务供应商的健康检查接口用于检测服务可用性，当服务供应商返回状态码不为0值时欢行认为检测失败。连续5次检测失败时会暂时将服务供应商的应用下线，待健康检查恢复正常时再对应用进行恢复。
28375,cainiao.endpoint.locker.spi.gui.open,自提柜开柜操作,自提柜开柜操作
28377,alibaba.happytrip.taxi.order.notify,状态通知,当订单发生变化是供应商通过状态通知API通知欢行，欢行获取最新的订单详情和状态进行业务处理。
28378,alibaba.security.jaq.realid.alipassport.getrpdepict,阿里通行证-查询实人属性,codeValue查询实人属性
28383,taobao.item.detail.get,商品详情获取接口,获取商品详情数据
28394,cainiao.bms.order.consign.confirm,BMS出库通知,BMS出库后，通知ISV
28397,taobao.qiannniu.incbook.account.employee.extend.query,千牛企业账号扩展信息查询,千牛企业账号基础信息查询
28398,taobao.qiannniu.incbook.account.employee.base.query,获取账号基本信息,获取企业版账号基本信息
28406,alibaba.music.social.comment.addcommenttoweb,评论网站发布,alibaba.music.social.comment.addcommenttoweb
28410,taobao.ailab.aicloud.player.control,设备播放控制,设备播放控制
28411,taobao.ailab.aicloud.device.authcode.get,获取设备授权码,获取硬件授权码
28413,alibaba.security.jaq.app.official.verify,聚安全验证官方应用接口,接入用户来查询应用是否为官方应用
28414,alibaba.security.jaq.app.official.apply,聚安全官方应用申请,官方应用申请接口
28415,alibaba.wdk.pos.order.getbillinfo,获取打印小票数据,获取打印小票数据
28416,alibaba.item.imap.asyncmap,imap商品异步转换服务,异步全量MAP
28417,cainiao.endpoint.locker.spi.order.authcode.resend,自提柜重发取件码短信,自提柜重发取件码短信
28419,taobao.xhotel.invoice.print,打印发票,打印发票
28420,taobao.xhotel.invoice.create,创建发票,创建发票
28421,taobao.xhotel.invoice.query,空白发票查询,空白发票查询
28422,taobao.baichuan.aps.feedback.save,百川反馈数据保存,保存百川反馈数据
28424,yunos.tv.tao.syncdatapull,电视淘宝数据拉取接口,获取电视淘宝应用升级的版本信息
28425,taobao.xhotel.invoice.info.query,查询发票信息,查询发票信息,包括每条发票信息的（发票抬头、公司税号、注册地址、开户行、银行账号、电话）6个信息
28427,taobao.apolloplatform.lawyerinfo.push,向法律工具推送律师信息,赢了网主动向法律工具推送分配的律师信息
28428,alibaba.scm.gateway.flash.refund.syn,魅力惠闪购仅退款,魅力惠闪购仅退款
28429,alibaba.scm.gateway.refund.goods.create,创建退货接口,创建退货接口
28430,alibaba.scm.gateway.flash.refund.goods.cancel,取消消退退货,魅力惠闪购仅退款
28432,taobao.tmc.minor.get,获取消息镜像分组,消息可根据用户路由到不能消息分组，每个分组的消息只投递一次。
此API可获取该消息分组对应的所有镜像分组。
28433,taobao.tmc.minor.add,增加消息镜像队列,消息可根据用户路由到不能消息分组，每个分组的消息只投递一次。
此API可克隆该分组所有消息。每个分组只能创建9个镜像分组。
镜像分组和普通分组无不干扰。
28434,taobao.opencrm.ruleinstance.add,规则实例创建,规则实例创建
28436,taobao.opencrm.coupon.query,优惠券查询接口,优惠券查询接口
28437,taobao.opencrm.ruleinstance.query,批量规则实例查询,批量规则实例查询
28438,taobao.wdk.wms.gateway.bill.callback,单据回传homs,单据回传homs
28439,taobao.opencrm.rule.batchadd,批量新增规则,批量新增规则
28440,taobao.opencrm.rule.query,查询规则,查询规则
28443,taobao.opencrm.rulecfg.query,规则通用配置查询,规则通用配置查询
28444,taobao.opencrm.ruleinstance.batchadd,批量规则实例化,批量规则实例化
28445,taobao.opencrm.ruleinstance.status.update,规则实例状态更新,规则实例状态更新
28446,taobao.opencrm.rule.add,创建规则,单个创建规则
28447,taobao.opencrm.rule.exerule,规则计算服务接口,ISV可输入规则计算参数，传入后，规则平台查找对应的规则进行计算后返回结果
28448,taobao.opencrm.rulecfg.update,规则通用配置修改,进行规则通用配置修改接
28449,taobao.opencrm.point.update,积分变更接口,用于isv的积分兑换接口
28450,taobao.opencrm.grade.update,等级更新修改,等级更新修改
28451,taobao.opencrm.crowd.check,校验商家人群是否被使用,检查商家人群使用信息
28452,taobao.opencrm.grade.query,会员等级查询,会员等级查询
28453,taobao.opencrm.crowds.query,商家人群列表查询,商家现有全网人群列表查询接口
28454,taobao.opencrm.point.send,积分发送接口,积分发送接口
28459,taobao.opencrm.analysistask.createupdate,分析任务创建接口,分析任务创建接口
28460,taobao.opencrm.signature.adddelete,短信签名增加删除接口,短信签名增加删除接口
28461,taobao.opencrm.signature.query,短信签名查询接口,短信签名查询接口
28462,taobao.opencrm.analysisreport.get,新建分析报告获取接口,分析报告获取接口
28463,taobao.opencrm.grade.batchadd,等级创建,创建商家的等级原数据
28464,taobao.opencrm.crowdinst.status.get,查询人群快照状态,获取人群快照状态
28468,taobao.opencrm.crowdinst.filter,根据订单条件筛选人群快照,人群快照订单筛选生成新的人群快照。
28469,taobao.opencrm.benefit.customer.query,买家端查询权益活动的接口,买家端查询权益活动的接口
28470,taobao.opencrm.member.get,获取会员基础信息,获取会员基础信息
28471,taobao.opencrm.node.filter,筛选营销节点执行结果,筛选营销节点执行结果
28472,taobao.opencrm.shortmessage.send,发送短信接口,发送短信接口
28473,taobao.opencrm.testtmc.send,测试TMC发送接口,测试TMC发送接口
28474,taobao.opencrm.nodereport.get,节点报告获取接口,节点报告获取接口
28475,taobao.opencrm.coupon.send,优惠券发送接口,优惠券发送接口
28476,taobao.opencrm.activitydetail.createupdate,营销活动详情创建更新接口,营销活动详情创建更新接口
28477,taobao.opencrm.activity.createupdate,营销活动创建更新接口,营销活动创建更新接口
28478,taobao.opencrm.crowd.coverage.count,统计人群买家覆盖信息,统计人群覆盖的买家信息
28479,taobao.opencrm.tags.query,商家可用标签列表查询,商家已订阅标签列表查询
28480,taobao.opencrm.crowd.get,人群信息查询,查询商家人群信息接口
28481,taobao.opencrm.tag.get,获取标签信息,根据标签编码查询对应的标签信息，包含标签名称、类型、属性值的范围类型枚举值等
28482,taobao.opencrm.crowd.update,编辑商家人群,更新商家人群信息
28483,taobao.opencrm.grade.status.switch,等级状态切换,等级状态切换
28484,taobao.opencrm.point.available.query,查询买家可用积分数,查询买家可用积分数
28485,taobao.opencrm.benefit.grade.query,等级权益查询接口,等级权益查询接口
28486,taobao.opencrm.benefit.grade.save,更新等级对应的权益接口,更新等级对应的权益接口
28487,taobao.opencrm.crowd.delete,删除商家人群,删除商家的人群
28488,taobao.opencrm.point.detail.query,买家维度查询积分变更列表,买家维度查询积分变更列表
