27794,alibaba.security.jaq.captcha.verify.result.fetch.intl,聚安全安全验证检查结果获取接口（国际版）,为国际版用户获取二次验证的结果
27795,taobao.edu.paper.successcallback,淘宝教育外部厂商回调,淘宝教育外部厂商回调
27796,taobao.edu.paper.query,查询论文检测进度,查询地方检测进度
27797,taobao.edu.paper.failcallback,论文检测失败回调,论文检测失败回调
27798,taobao.xiaoqu.item.returned,商家通知淘宝退货已经收到,商家通知淘宝退货已经收到
27799,taobao.promotion.activity.flowsyndata,同步统一营销流量数据,同步统一营销流量数据给isv
27800,taobao.promotion.activity.flowsyninfo,硕软同步数据信息查询,硕软同步数据信息查询
27804,taobao.item.sanjiang.pricechange,修改商品价格,商家修改商品价格
27807,taobao.zuanshi.advertiser.adzone.rtrpts.get,钻展广告主资源位分时数据查询,钻展广告主资源位分时数据查询
27808,taobao.zuanshi.advertiser.account.rtrpts.get,钻展广告主账户整体分时数据查询,查询钻展账户级别分时报表数据。
27809,taobao.ailab.aicloud.auth.captcha.send,发送手机验证码,发送验证码到用户手机，作为用户登录的验证
27811,taobao.zuanshi.advertiser.target.rtrpts.get,钻展广告主定向分时数据查询,钻展广告主定向分时数据查询
27812,taobao.zuanshi.advertiser.campaign.rtrpts.get,钻展广告主推广计划分时数据查询,钻展广告主推广计划分时数据查询
27813,taobao.zuanshi.advertiser.adgroup.rtrpts.get,钻展广告主推广单元分时数据查询,钻展广告主推广单元分时数据查询
27814,taobao.zuanshi.advertiser.creative.rtrpts.get,钻展广告主创意分时数据查询,钻展广告主创意分时数据查询
27815,taobao.wdk.wms.conveyor.get.container,波次打包完成指令,波次打包完成指令
27816,taobao.wdk.wms.conveyor.update.container,波次打包完成下传确认回传,波次打包完成下传确认回传
27817,taobao.wdk.wms.conveyor.update.arrive,料箱到达道口回传,料箱到达道口回传
27818,taobao.wdk.wms.conveyor.update.assgin,料箱分配道口回传,料箱分配道口回传
27819,taobao.alitrip.flightchange.add,航变信息录入接口,代理商调用航变录入接口,
    简要描述:完成航变信息的自动录入后阿里旅行机票平台会发生的动作是匹配所有该代理人的订单,
找到与航变航班相关的订单给旅客下发航变短信并出发IVR自动外呼旅客。
27821,alibaba.bogda.suitcase.dominationresult.pull,诉讼推送管辖信息给法宝,推送管辖异议信息给法宝
27822,taobao.alitrip.flightchange.get,获取航变信息,查询航变是为了两个目的，阿里旅行抓取到未确认航变的航变信息源时可以由代理确认航变，同时对于确认航变的航变信息也共享给代理人做本体业务使用。
27823,taobao.ailab.aicloud.auth.login,用户登录,用户登录
27826,taobao.ailab.aicloud.user.update,用户信息更新,用户基本信息更新
27827,taobao.ailab.aicloud.user.get,获取用户信息,获取用户app相关的基本信息
27828,taobao.ailab.aicloud.auth.logout,用户登出,用户登出
27831,alibaba.lottery.bingo.check,游戏交易状态确认,外部游戏交易状态确认接口
27832,taobao.tbk.spread.get,物料传播方式获取,输入一个原始的链接，转换得到指定的传播方式，如二维码，淘口令，短连接；
现阶段只支持短连接。
27833,yunos.id.sign.check,id2验签接口,对id2对指定字符串的签名进行校验
27834,taobao.cloudbridge.sellerinfo.check,工商校验商家数据是否存在阿里商家数据信息中,提供工商系统校验商家信息是否存在于阿里系统中
27835,alibaba.lottery.bingo.init,游戏初始化,外部游戏初始化接口
27836,alibaba.lottery.bingo.heartbeat,游戏平台心跳,外部游戏平台心跳同步接口
27837,alibaba.lottery.bingo.sync,游戏结果同步,外部游戏结果同步接口
27838,alibaba.lottery.bingo.play,游戏创建交易接口,外部游戏初始化接口
27842,alibaba.alihealth.healtharchive.examination.reserve.citylist,可预约城市列表,已开通接口预约的城市
27843,alibaba.alihealth.healtharchive.examination.reserve.report,获取报告,获取报告
27844,alibaba.alihealth.healtharchive.examination.reserve.status,体检状态同步,体检状态同步
27845,alibaba.alihealth.healtharchive.examination.reserve.cancel,取消预约,取消预约
27846,alibaba.alihealth.healtharchive.examination.reserve.book,预约,预约
27847,alibaba.alihealth.healtharchive.examination.reserve.branchinfo,获取分院资源,获取分院资源
27848,alibaba.alihealth.healtharchive.examination.reserve.group,写入分组信息,写入分组信息
27849,alibaba.alihealth.healtharchive.examination.reserve.person,写入人员信息,慈铭用户预约提交接口，部分城市门店机构反馈机房网络原因存在超时情况
27850,alibaba.alihealth.healtharchive.examination.reserve.validate,校验卡密,校验卡密
27852,yunos.tv.advert.site.unified.get,获取优酷数娱统一广告位,youku 广告SDK调用，从youku广告库或者AFP获取广告
27854,taobao.cloudbridge.sellerinfo.exchangeinfo,工商局和阿里交换数据信息,工商局将检查到在阿里系统内的商家信息同步给阿里，阿里返回工商所需要的商家其他信息
27855,taobao.alitrip.content.standard.batchadd,阿里旅行标准内容批量输入,批量写入多媒体标准内容，并及时反馈提交状态
27857,alibaba.einvoice.dyn.group,发票动态组配置,读取发票动态组配置
27867,alibaba.oneservice.yt.realtime.list,优土双11直播大屏,优土双11大屏需要展示相应的实时指标
27868,alibaba.aliqin.secret.xh.issecretno,是否是小号（C小号、B小号）,是否是小号（C小号、B小号）
27872,cainiao.endpoint.locker.spi.order.query,查询柜子订单,查询柜子订单
27873,cainiao.endpoint.locker.spi.order.cancel,取消柜子订单,取消柜子订单
27874,cainiao.endpoint.locker.spi.order.subscribe,预约自提柜,预约自提柜
27875,cainiao.endpoint.locker.spi.order.state.sync,同步订单状态,同步订单状态
27876,cainiao.endpoint.locker.misc.order.tracking,自提柜订单跟踪消息,自提柜公司回推送消息
27877,cainiao.endpoint.locker.maintain.create,菜鸟自提柜操作对接,自提柜创建
27879,taobao.xiaoqu.order.tlogmsg.get,小区订单消息tlog获取,为闪电购提供一个订单消息查询的接口，可以通过此接口得到小区平台发送给商家的消息和商家给小区平台的信息。
27880,cainiao.endpoint.locker.spi.order.cancel.authcode,指定开柜码使用后结束订单,指定开柜码使用后结束订单
27881,cainiao.endpoint.locker.spi.order.extend,订单延时,订单延时
27887,alibaba.flashscm.purchase.all.get,闪购SCM采购单查询,基于采购单状态及账套，进行采购单分页查询
27892,alibaba.flashscm.supplier.all.get,供应商查询,供应商查询接口
27893,alibaba.flashscm.purchase.item.add,采购详单批量同步,采购详单批量同步
27898,taobao.jst.trade.query,根据订单号查询单笔订单数据,根据订单号查询单笔订单数据
27899,alitrip.xhotel.order.cancelrq_V1,取消酒店订单,请求商家提供的取消订单服务，传递模拟订单取消参数
27900,alitrip.xhotel.order.querystatusrq_V1,查询酒店订单请求,请求商家提供的查询订单服务，传递模拟订单查询参数
27901,alitrip.xhotel.order.validaterq_V1,酒店试单请求,系统在用户下单时调用第三方的试单服务来确认产品是否可售。
27902,taobao.alitrip.travel.item.element.query,【API3.0】资源元素查询接口,提供资源元素查询接口，支持商家查询已经发布过的资源元素
27905,alitrip.ie.buyer.order.bookpay,【国际机票】下单预定支付,【国际机票】 生单预定支付接口
27906,yunos.dataplatform.api.zebra.general.get,数据服务分发平台对外通用接口,通过此api可以查询数据服务平台数据
27907,taobao.globalbuys.seamail.taxfee,直邮服务商推送税费接口,直邮服务商会向全球购推送物流订单的接口
27908,taobao.globalbuys.seamail.postfee,跨境服务平台邮费推送接口,直邮服务商会向全球购推送物流订单的接口哦
27909,taobao.globalbuys.seamail.exception,服务商异常订单推送,物流服务商根据订单的实际情况推送异常订单到全球购平台，用以标记哪些订单出现了问题，避免扣费出现
27911,alibaba.qiandun.deviceinfo.decrypt,设备标识解密接口,对合作伙伴提供设备标识解密功能，与合作伙伴交换数据时，设备标识（IMEI、IDFA等）以密文提供，合作伙伴需要通过此接口来换取明文信息
27913,alibaba.mj.xlife.intime.order.addlist,银泰订单批量导入,银泰订单批量导入
27919,cainiao.guoguo.task.reject.getrejectreasons,拒单原因接口,查询拒单原因
27925,taobao.bus.busnumber.set,商家汽车票车次更新通知接口,商家汽车票车次更新后，调用该接口通知平台。
27926,alibaba.alihealth.healtharchive.examination.reserve.ikang.gethospinfos,获取套餐下城市分院接口,获取套餐下城市分院接口
27927,alibaba.alihealth.healtharchive.examination.reserve.ikang.getpackagedetail,获取套餐详情接口,获取套餐详情接口
27928,alibaba.alihealth.healtharchive.examination.reserve.ikang.getpackage,获取卡套餐接口,获取卡套餐接口
27929,tmall.purchase.logistrace.fetch,采购订单物流跟踪信息拉取,采购订单物流跟踪信息拉取
27930,alibaba.alihealth.healtharchive.examination.reserve.ikang.grantuserreportview,用户报告查看授权,用户报告查看授权
27931,alibaba.alihealth.healtharchive.examination.reserve.ikang.cancelorder,取消预约单接口,取消预约单接口
27932,taobao.film.fcode.merchant.third.party.send,外部第三方发券,淘宝电影外部商家发码
27935,alibaba.alihealth.healtharchive.examination.reserve.ikang.getreport,报告查询接口,报告查询接口
27936,alibaba.alihealth.healtharchive.examination.reserve.ikang.findcheckdataback,预约到检查询接口,预约到检查询接口
27937,alibaba.alihealth.healtharchive.examination.reserve.ikang.login,爱康登陆,爱康体检的账号校验
27938,alibaba.alihealth.healtharchive.examination.reserve.ikang.getschedules,获取体检机构排期接口,获取体检机构排期接口
27939,alibaba.alihealth.healtharchive.examination.reserve.ikang.saveorderinfo,预约单保存接口,预约单保存接口
27940,alibaba.alihealth.healtharchive.examination.reserve.ikang.findorderinfo,预约单查询接口,预约单查询接口
27941,alitrip.ticket.scenic.query,【门票API2.0】门票景点以及收费项目匹配关系查询接口,门票景点以及收费项目匹配关系查询接口
27942,alitrip.ticket.rule.query,【门票API2.0】门票规则信息查询接口,门票规则信息查询接口：返回商家上传的门票规则信息
27943,taobao.interactive.list.getbyuser,用户获取视频互动列表,根据用户来获取用户编辑的互动列表
27945,alitrip.ticket.product.query,【门票API2.0】门票商品查询接口,门票商品查询接口：返回商家上传的门票商品信息
27946,alitrip.ticket.scenic.bind,【门票API2.0】门票景点绑定接口,门票景点绑定接口，用于建立阿里标准景点id与商家系统景点id的映射关系。该接口同时支持新建和修改映射关系，当用户没有为ali_scenic_id建立过映射关系时，则判断为新建映射关系，否则为修改。可以通过设置update_out_scenic_id来修改ali_scenic_id与out_scenic_id的映射关系。
27947,alitrip.ticket.skus.upload,【门票API2.0】门票价格库存同步接口,航旅度假新版门票商品价格库存同步接口。
注1、一个票种下可以挂多个规则（规则id必须不一样，每个规则实际对应了一个sku），同一个规则可以在不同票种下使用。
注2、日历库存和区间库存门票，统一使用DateInventory结构。对于日历库存门票请上传每一天的价格库存；对于区间库存门票，建议只上传开始和结束日期的价格库存，也支持上传每天的价格库存，系统会自动进行聚合（取第一天的价格为区间价格，累计所有天的库存为区间库存）。
注3、该接口同时支持 新增某个规则的价格库存 和 更新现有规则的价格库存。如果不清楚是否已在某个规则下上传过价格库存，请使用alitrip.ticket.product.query接口进行查询。如果该规则在该票种下已经存在，则该接口会判断为是价格库存更新操作。
27949,alitrip.ticket.rule.upload,【门票API2.0】景点门票规则维护接口,景点门票规则维护接口。该接口同时支持新发规则和编辑现有规则，如果out_rule_id下没有发布过规则，则系统将判断为新发一个规则，否则认为是编辑现有规则。
对于新发布规则的情况，有些参数是必填的，请仔细查看各字段说明。对于编辑的情况，除out_rule_id外都是可选，编辑情况支持增量更新（某个参数不传则使用该规则上原有值）
27950,alitrip.ticket.product.upload,【门票API2.0】门票收费项目管理接口,航旅度假新版门票商品（门票收费项目）管理接口：支持门票商品的发布、编辑。如果在ali_product_id下没有发布过门票商品，则系统将判断为新发布商品，否则是编辑已有商品。可以通过辅助查询接口判断是否已在某个ali_product_id下发布过门票商品。
对应新发布商品的情况，有些参数是必填的，请仔细查看各字段说明。对于编辑商品的情况，ali_product_id和out_product_id至少需要填一个，其他参数都是可选，编辑情况支持增量更新（某个参数不传则使用该商品上原有值）。
27951,alibaba.security.jaq.checkaccountandpasswordrisk.result.fetch,账密检测服务,账密检测服务
27953,yunos.algorithm.api.get,智能算法平台,提供云os算法服务，比如人脸识别，图片识别等。。。
27954,taobao.wangwang.eservice.chatrelation.get,聊天关系获取接口,获取指定时间区间内的聊天关系（查询账号，和谁，在哪天说过话）。如：
A 和 B 在2016-09-01 和 2016-09-02 都说过话。以A为查询账号，则该接口将返回：
2016-09-01， B
2016-09-02， B
27960,taobao.vmac.show.get,获取媒资节目信息,根据节目ID获取节目信息
27961,taobao.vmac.mediamessage.gets,获取媒资消息,获取媒资节目和视频变更的消息。
使用说明：
当offset值为0值或者不传此值，即可以开始分页或者最近5天内的所有消息。当需要获取下一页内容时，需要使用
27964,alibaba.mj.xlife.intimeright.callback,银泰券回调,银泰券回调接口
27966,alibaba.einvoice.invoiceapply.get,获取商家的开票申请,开票服务商接收到商家发起的开票申请消息后，调用此接口拉取商家详细的开票申请内容
27967,alibaba.einvoice.invoiceapply.update,商家开票申请单状态回传,开票服务商更新商家开票申请单状态
27968,taobao.vmac.videopage.get,视频分页数据输出,数娱内容 视频分页数据输出
27969,taobao.vmac.showpage.get,获取节目分页,获取数娱媒资节目分页
27971,taobao.vmac.video.get,获取媒资视频信息,根据视频ID获取视频信息
27972,taobao.xhotel.multiplerate.delete,复杂价格删除,酒店产品库rate删除
27974,alibaba.flashscm.item.syn,自营商品同步接口单个商品,自营商品同步接口(单个商品)
27975,alibaba.flashscm.common.brand.syn,品牌同步（单个接口）,品牌同步（单个接口）
27976,alibaba.flashscm.common.category.syn,自营类目同步接口,自营类目同步接口（需要先创建父类目）
27977,alibaba.flashscm.item.relation.add,商品关联关系添加接口,商品关联关系添加接口
27978,tmall.search.product.get,天猫商品搜索接口,提供电视淘宝天猫商品搜索功能
27979,cainiao.guoguo.cp.backup.assigncourierbyid,根据菜鸟账号ID指派小件员,根据菜鸟账号ID指派小件员
27980,alibaba.wdk.item.query.future.price,获取商品变价记录,获取商品变价记录
27981,alibaba.wdk.wmsoutput.autooutstock,寺岗自动出货,寺岗自动出货
27982,alibaba.wdk.wmsinner.autofinishproduct,寺岗自动成品入库,寺岗自动成品入库
27983,taobao.user.tv.get,获取授权用户的淘宝昵称,供电视淘宝使用，获取授权绑定用户的淘宝昵称
27984,taobao.promotion.coupon.tv.search,查询用户优惠券列表,查询电视淘宝绑定用户在该平台的领用优惠券列表
27986,alibaba.aliqin.secret.axb.get.txtFile,通话记录文本文件（字符串）,通话记录文本文件（字符串）
27988,taobao.drug.quantity.batch.update,批量同步库存接口,商家通过top接口可以批量修改商品库存
27989,taobao.drug.price.batch.update,商家批量更新宝贝价格,商家批量更新宝贝价格
27990,taobao.media.video.list,获取商家视频列表,用于获取授权商家的视频列表
27991,tmall.service.settleadjustment.query,调整单根据工单ID查询,根据工单ID查询调整单信息
27992,alitrip.btrip.flightorder.get,商旅机票订单数据开放,商旅机票订单数据开放
27994,cainiao.member.wireless.courier.checkcpmobilecode,绑定用户手机,通过该api提交验证码，将用户的手机号码绑定到账号上
27995,cainiao.member.wireless.courier.isalipaycertified,小件员账号是否已经通过支付宝实名认证,根据sessionId查询当前用户是否已经通过支付宝实名认证
27996,cainiao.member.wireless.courier.getalipaysigndata,根据随机串获取支付宝签名,根据客户端生成的随机串，返回支付宝签名串，用于支付宝客户端授权
27998,cainiao.member.wireless.courier.bindalipaybyauthcode,通过支付宝authCode绑定支付宝,通过支付宝authCode绑定支付宝
27999,cainiao.member.wireless.courier.getcouriercps,获取包裹侠的cp列表,获取包裹侠的cp列表，返回结果是个Map结构，映射为cpCode:cpName
28000,cainiao.member.wireless.courier.register,注册包裹侠账号,注册包裹侠账号
28003,cainiao.member.wireless.courier.sendbindingcpmobilecode,发送绑定cpMobile的验证码,发送绑定cpMobile的验证码
28004,cainiao.member.wireless.courier.getregistercheckinfo,包裹侠获取用户注册过程确认信息,包裹侠获取用户注册过程确认信息
28005,cainiao.member.wireless.courier.getuserverifytoken,获取实人认证人脸识别验证token,获取实人认证(人脸识别)验证token
28006,cainiao.member.wireless.courier.sendchangecpmobilecode,发送更换手机cpMobile号码验证码,发送更换手机(cpMobile)号码验证码
28007,cainiao.member.wireless.courier.changecpmobilecheck,通过支付宝authCode判断是否可以修改手机号,通过支付宝authCode判断是否可以修改用户手机号，如果可以，则返回安全码
28008,cainiao.member.wireless.courier.checkchangecpmobilecode,验证修改用户手机cpMobile验证码并绑定,验证修改用户手机(cpMobile)验证码并绑定
28009,cainiao.member.wireless.courier.unbindingalipay,根据支付宝授权，解绑支付宝账号,根据支付宝授权，解绑支付宝账号
28010,cainiao.member.wireless.courier.getuserverifyrpstatus,查询当前用户的人脸识别状态,查询当前用户的人脸识别状态
28011,cainiao.member.wireless.courier.getuserinfolistbyalipay,根据支付宝authCode获取用户列表,根据支付宝authCode获取用户列表
28012,cainiao.member.wireless.courier.sendregistercheckcode,包裹侠根据手机号码发送注册手机验证码,包裹侠根据手机号码发送注册手机验证码
28015,taobao.wangwang.eservice.abs.word.get,获取关键词,获取关键词列表
28016,taobao.wangwang.eservice.abs.word.del,删除关键词接口,删除关键词接口
28017,taobao.wangwang.eservice.abs.word.add,添加关键词,为聊天记录查询接口添加关键词。
28018,cainiao.guoguo.delivery.verify,查询小件员认证需求信息,查询小件员认证需求状态
28019,taobao.wangwang.eservice.abs.chatlog.get,商家聊天记录查询接口,查询授权商家的聊天记录
28021,taobao.xhotel.order.confirm.delay,订单确认延时,订单申请确认延时
28022,alibaba.fmhealth.weight.lossplan.getrecipesbyweek,获取一周食谱,1.创建或者修改减肥计划
2.获取一周食谱
3.新增卡路里返回
4.新增token返回
28023,taobao.globalbuys.seamail.identity,身份证获取接口,直邮服务商根据订单中的信息获取对应的买家身份证数据
28024,taobao.supplier.customs.declare,供应商申报支付单接口,供应商订单申报支付单接口
28025,taobao.film.lottery.phone.draw,电影票引流发券,对外第三方合作渠道发码领券
28028,alitrip.btrip.corp.flightorder.get,获取商旅企业差旅机票订单数据,差旅企业机票数据开放，只开放给本企业
28029,alibaba.aliqin.trade.create,阿里通信运营商订单信息创建,阿里通信运营商订单信息创建
28032,alibaba.einvoice.partner.createreq,开票服务商开票接口,电子发票开具接口，需要由开票服务商实现
28034,alibaba.fmhealth.weight.lossplan.getrecipesbyday,按天获取食谱,按天获取减重食谱
28035,tmall.maoning.coupon.url.generate,生成优惠券链接,苏宁的运营创建好优惠券后，通过调用这个接口生成优惠券对外投放的链接
28036,tmall.maoning.activity.data.detail,查看活动数据详情,读取苏宁自己店铺的优惠券等活动的详细数据，如优惠券发了多少张、已使用多少张等等
28037,tmall.maoning.activity.expire,失效猫宁活动,苏宁在自己的CRM系统失效一个活动，审批完成后提交给天猫，天猫根据类型失效对应的活动
28038,tmall.maoning.activity.modify,修改猫宁活动,苏宁在自己的CRM系统修改一个活动，审批完成后提交给天猫，天猫根据类型修改对应的活动
28039,tmall.maoning.activity.create,新建猫宁活动,苏宁在自己的CRM系统创建一个活动，审批完成后提交给天猫，天猫根据类型创建对应的活动
28041,taobao.xiaoqu.class.query,分类查询接口,分类查询接口
28042,taobao.xiaoqu.item.query,商品查询,商品查询
28044,taobao.xiaoqu.itemclass.createOrUpdate,分类新建或修改,商品分类新建或更新
28045,taobao.paimai.tbcar.upload.file,第三方检测机构上传检测报告文本,提供第三方汽车检测机构上传检测报告文本
28046,taobao.xiaoqu.item.createorupdate,便利店商品创建,商品创建和修改
28057,taobao.paimai.tbcar.publish.report,提供第三方汽车检测机构发布检测报告文本,提供第三方汽车检测机构上传检测报告文本
28061,taobao.xiaoqu.class.itemquery,查询分类下所有商品,商家查询分类下所有商品
28062,taobao.xiaoqu.item.delete,商家删除发布的商品,商家删除发布的商品
28063,tmall.mei.item.quantity.update,魅力惠库存更新接口,天猫商品/SKU库存更新接口；支持商品库存更新；支持同一商品下的SKU批量更新。
28065,taobao.wt.trade.order.resultcallback,商家回调接口,阿里通信定制服务，商家发货后进行调用该接口，用于自动发货并确认收货
28067,taobao.paimai.tbcar.upload.pic,第三方检测机构上传图片,第三方检测机构上传图片
28068,cainiao.cloudprint.single.customarea.get,获取商家单一自定义区,商家所有快递公司模板只有一个自定义区
28070,alibaba.mj.xlife.intime.item.addlist,银泰商品信息同步,银泰商品信息同步
28071,alibaba.mj.xlife.intime.store.addlist,银泰门店信息同步,银泰门店信息同步到喵街
28075,cainiao.member.courier.cpresign,cp清理离职用户信息,CP清理内部离职的用户信息
28081,taobao.xiaoqu.sdg.stockchange,闪电购专属库存同步,闪电购专属库存同步
28082,taobao.xiaoqu.material.change,库存同步,库存同步
28084,tmall.promotiontag.appointment.order.verify,ISV核销订单,ISV核销订单
28085,taobao.xiaoqu.item.idget,全量拉取该商家自己的商品id,全量拉取该商家自己的商品id
28086,tmall.promotiontag.appointment.order.cancel,ISV取消订单,ISV取消订单
28088,yunos.tv.tao.blacklistfilterservice,电视淘宝积分黑名单,电视淘宝发积分过滤黑名单
28089,alibaba.wdk.item.open.update,五道口商品中心更新商品,五道口商品中心更新商品
28090,alibaba.wdk.item.open.add,添加商家商品,五道口商品中心，提供对外部商家接口，新增商品
28094,alibaba.einvoice.partner.amount.check,发票日开票量核对接口,发票日开票量核对接口
28095,alibaba.einvoice.partner.inventory.query,税号可用发票余量查询接口（税局和税盘）,税号可用发票余量查询接口（税局和税盘）
28097,tmall.promotiontag.appointment.order.verify.postback,ISV 核销后数据回传,ISV 核销后数据回传
28098,tmall.promotiontag.isv.member.register,调用ISV 注册会员,调用ISV 注册会员
28099,tmall.promotiontag.isv.appointment.operation,调用ISV 同步核销/取消预约,调用ISV 同步核销/取消预约
28100,tmall.promotiontag.isv.appointment.create,调用ISV 同步预约,调用ISV 同步预约
28101,tmall.promotiontag.isv.member.query,调ISV查询会员,调ISV查询会员
28102,alitrip.btrip.corp.applyorder.add,外部申请单同步回流,同步外部审批单
28103,alibaba.lassen.abroad.caseinfo.send,案件其他信息推送,案件其他信息推送 案件的证据 案件的诉讼主体 案件的诉讼请求
28106,alibaba.mj.xlife.intimeright.generic.callback,银泰通用券核销回调,银泰通用券核销回调
